A2788UYAD532T,0634061801,Having recently revived my desire to improve on the guitar I purchased this video. I had just purchsed another DVD with which I was very happy and decided that any decent guitarist needed some blues licks in their repertoire. I had a more difficult time following along with this one than I did on the previous purchase. This one comes with a hard copy of the Tabulature but I'm convinced that in many places the Tabs don't match what he says to play or actually does play. That's a little frustrating for me. I do give it 3 stars because I do think as I improve there will be some learning opportunities but at my current skill level it's a bit over my head so that makes it not very valuable for now. Perhaps there should be a grading/age/skill level system like they do for kids' toys that allows for consumers to judge how advanced you need to be to get value from a product or if it's even suitable.,WannabeClapton,3.0,"May 6, 2007"
A1746NHDF3PF3H,0634065459,After performing bottleneck gospel/blues professionaly for the past 12yrs I've noticed a trend amongst my generation (30somethings) of players which concerns me greatly...wild fast sloppy playing sounds more authentic.  I have had numerous conversations with fellow players attempting to convince them that fast and sloppy playing isn't more authentic it's just fast and sloppy playing.Brozman makes it a point to address just that in DVD 1.  He states that the originators were trying thier best to play as clean as possible but due to bad strings bad guitars and pretty lowsy recording equipment it created a challenge to do so although many did achieve very clean playing (Tampa Red Blind Willie Johnson Robert Johnson etc.).DVD 1 is critical in learning the fundamentals of control both with slide and picking.  I highly recommend DVD 1 for any players.DVD 2 covers classic detla blues material Brozman style.  Plenty of tricks to be learned even if your not looking to sound like a Brozman copy.DVD 3 expands into more open tunings.  Again plenty of tricks to be learned.Whether these are too advanced for the beginner I cannot say because I'm not a beginner.  I can say that minutes into DVD 1 I wished I had these DVD's when I was learning because it's taken me 12yrs to acquire the skills I could've learned in months of working with these lessons.ALl in all these DVD's will help get the wheels of creativity flowing in your own playing...and playing clean.,T. Feldmann,5.0,"January 25, 2011"
A26LIKTL5KW29E,0739003755,This is a two CD set each CD is 30 minutes long.  The second CD is for the music discovery book I love this CD it is just perfect for group music classes and it is a fun CD for kids to just listen to.  There are 25 songs: a hello song (mentions mozart mouse and beethoven bear) a goodbye song (could be used for any program) 8 rhythm instrument songs 5 movement/music appreciation songs and 8 listening/ear training songs.The first CD is essentially a book on CD of the music lesson book and I don't see why you would ever use it because a teacher could read the story herself much more entertainingly.,3_Angels,5.0,"June 5, 2008"
A4TE45TH7L2MW,0739003755,The Discovery CD has songs for singing and movement. There are some original songs as well as familiar tunes. The Listen and Sing examples are short easy songs to help students learn solfeggio syllables la-ti-so-re-mi. The Lesson Book CD tells the story of Mozart Mouse and Beethoven Bear exploring the magical music book as they learn to play piano. Children play with their plush toys and play piano/keyboard along with the lessons. The lessons are well organized and fun for very young children. Some of the songs on the Discovery CD include:Hello SongIf You're Happy and You Know ItRacing CarClownin' AroundFinger Play SongHickory Dickory DockMexican Hat DanceBeethoven's Rage Over the Lost PennyMozart's Variations on Twinkle TwinkleOld MacDonald Had a FarmMister Elephant's Funky DanceSousa's Stars and Stripes ForeverGiant's LullabyDo Re Mi Tapping SongMinuet in FBeethoven's Symphony No. 5Twinkle Twinkle Little StarPut the Beat in Your FeetGoodbye Song,~AMH,5.0,"July 30, 2011"
A732DZLEGXSEQ,0739003755,This CD is absolutely awesome. My daughter loves listening to the stories of Clara Schuman Cat Beethoven Bear and Mozart Mouse. There are stories to listen to as well as wonderful renditions of the songs in the book. They have two differently played songs which helped my daughter a lot. It would be nice to have one of the renditions have the songs sung. Having to learn 10 songs for her recital with every song using the same 5 notes made it difficult for her to remember them all as they sounded so similar.,Jenny Lee,5.0,"May 18, 2012"
A142DE4DV7NKTQ,0739003755,As a lifetime piano teacher I love this child-friendly piano method for young children. Content is rich with a variety of musical experiences. And I have fun too with Mozart Mouse and Beethoven Bear.Its great to see the level of interest and readiness of a student.,Lois Seeger,5.0,"January 27, 2014"
AAUUICXM1YE8L,0739003755,Just like the previous reviewer says the two CD's are great in contents. For some reasons however my set came with labels switched around.  The one that said Music Lesson Book 1 was actually for Music Discovery Book 1 and vice versa. There must have been a mistake at the manufacturer.,Mary Chopin,4.0,"February 17, 2011"
A153V2QD4BJT1Z,0739003755,We are very happy with this series.  My son has special needs and benefits from music therapy weekly.  This series teaches about musical concepts with a story book format.  We also bought the companion CD and stuffed animals.,Musicmom,5.0,"March 24, 2013"
A2TKRYCS1POPOA,0739003755,We absolutely love this line of books. My 4 year old is now on the third set and playing away! It's made her lessons fun and easy. And I love that she can play with the cd's accompaniment.,NewMommy,5.0,"January 29, 2013"
A1IRFW13NXF08Z,0739003755,Since Music for Little Mozarts is based on the age group of 4-6 I am surprised that the music on the CD doesn't have tempo options for beginning lessons.  Also I think there could be more &#34notice&#34 given on when the songs will start just seems to quick or hurried.,R. Davis,3.0,"March 9, 2014"
A25UM6A6A4SEDT,0739037986,I would recommend this DVD to anyone interested in the construction and the materials in which pick ups are made from.  The history of the Semour Duncan Company is fascinating.  Anyone wanting a basic understanding of how pick ups works do yourself a favior and buy this DVD.,BrotherMike57,5.0,"December 22, 2008"
ADM67P7K66F41,0739037986,This is a great video with lots to learn and see. It is basically a tour of the SD factory with interviews with the Duncans. This may have started out like a fluff piece documenting the company but I really liked it. SD shows how he changes out pick-ups very cool. And it has a great educational section on the development sound and design of their products. Good. Great info available elsewhere in print and on the web but if you like moving pictures and like a good guitar story then $20 for this video is worth it.,Jeffrey Smith,3.0,"January 12, 2009"
A18C8JYM2161KE,0739037986,This was terrible. It gets right to the part you need to know to solder the pickups and then cuts and shows pickup already installed. I really dont see how anybody approved this for sale. If you are looking to learn how to install pickups and save yourself money at the guitar store - this DVD is worthless. Again the video footage cuts ahead at the critical point that would show you which wires to solder where. so disgusted.,M. Balzano,1.0,"August 27, 2008"
AK3MEBCSQ18LO,0739037986,I didn't think it was worth the money !I have used his pickups and they are fabulous .......Buy his pickups but skip the DVD !,R. Burns,2.0,"February 9, 2008"
A307SOXS9WP4GI,0739040251,If you want to know how drummers that have made it actually drum you'll want this video. If not you won't.,Bill Card,5.0,"February 4, 2013"
ASP16LVGFITDE,0739040251,As a drummer of 40+ years - (recovered but relapsing constantly) - Simon Phillips becomes my new hero with this video. His polyrythmic ambidexterity seems effortless and natural and his behind the scenes comentary and instruction are concise thorough and easily absorbable. A must-have DVD for any drummer desiring to improve his skill set. Five Stars!,Bill Moll,5.0,"October 29, 2010"
